COdigo Baremo;Descricao;VOZ;Tipo veIculo (Recurso);Escopo do problema (Ambito);Elemento Problema (Elemento);PrestaCAo;PrestaCAo_NIvel de TensAo;COdigo ACAo;Descricao acao;UN de Medida
3000020386;Amarração de árvores com corda (Vegetação);TBR120;BT;Rede BT;BT - LBT - Rede AErea Nua;WB0614;WB0614_BT;154;AMARRACAO DE ARVORES COM CORDA;UN
3000019681;Aplicação de grupo gerador > 160 kVA (Energia emergencial / alta potência);GHO103;BT;Rede BT;BT - LBT - Rede AErea Nua;WB0387;WB0387_BT;155;APLICACAO DE GRUPO GERADOR MAIOR QUE 160 KVA;UN
3000019758;Recondicionar, alinhar, aprumar ou verticalizar poste MT ou BT (Infraestrutura);AHO118;BT;Rede BT;BT - LBT - Cabo aEreo;WB0111;WB0111_BT;254;RECONDICIONAR, ALINHAR, APRUMAR OU VERTICALIZAR POSTE MT OU BT;UN
3000019491;Aviso de desligamento com assinatura (Comunicação);AHO722;BT;Rede BT;BT - LBT - Cabo aEreo;WB0200;WB0200_BT;467;AVISO DE DESLIGAMENTO COM ASSINATURA;UN
3000019988;Aviso de desligamento com assinatura (Comunicação);AHO722;BT;Rede BT;BT - LBT - Cabo aEreo;WB0200;WB0200_BT;467;AVISO DE DESLIGAMENTO COM ASSINATURA;UN
3000019489;Aviso de desligamento sem assinatura (Comunicação);AHO721;BT;Rede BT;BT - LBT - Cabo aEreo;WB0199;WB0199_BT;168;AVISO DE DESLIGAMENTO SEM ASSINATURA;UN
3000019986;Aviso de desligamento sem assinatura (Comunicação);AHO721;BT;Rede BT;BT - LBT - Cabo aEreo;WB0199;WB0199_BT;168;AVISO DE DESLIGAMENTO SEM ASSINATURA;UN
5000002746;Conexão de pontes bypass de média tensão com linha viva em substituição (Rede elétrica MT);ABR513;MT;Linha MT;MT - LMT - Rede AErea Nua;WB0698;WB0698_MT;158;CONEXAO DE PONTES (BYPASS) DE MEDIA TENSAO COM LINHA VIVA EM SUBSTITUICAO;CJT
5000003128;Conexão de pontes bypass de média tensão com linha viva em substituição (Rede elétrica MT);ABR513;MT;Linha MT;MT - LMT - Rede AErea Nua;WB0698;WB0698_MT;158;CONEXAO DE PONTES (BYPASS) DE MEDIA TENSAO COM LINHA VIVA EM SUBSTITUICAO;CJT
3000008024;Conexão de pontes bypass de média tensão com linha viva (Rede elétrica MT);ABR511;MT;Linha MT;MT - LMT - Rede AErea Nua;WB0694;WB0694_MT;157;CONEXAO DE PONTES (BYPASS) DE MEDIA TENSAO COM LINHA VIVA;CJT
3000008033;Conexão de pontes bypass de média tensão com linha viva (Rede elétrica MT);ABR511;MT;Linha MT;MT - LMT - Rede AErea Nua;WB0694;WB0694_MT;157;CONEXAO DE PONTES (BYPASS) DE MEDIA TENSAO COM LINHA VIVA;CJT
3000019856;Corte de bambu – sem retirada de resíduos (Vegetação);TBR128;BT;Rede BT;BT - LBT - Rede AErea Nua;WB0621;WB0621_BT;163;CORTE DE BAMBU - SEM RETIRADA DE RESIDUOS;UN
3000020390;Corte de bambu – sem retirada de resíduos (Vegetação);TBR128;BT;Rede BT;BT - LBT - Rede AErea Nua;WB0621;WB0621_BT;163;CORTE DE BAMBU - SEM RETIRADA DE RESIDUOS;UN
3000019845;Corte de área arborizada em linha de média tensão (Vegetação);THO104;MT;Linha MT;MT - LMT - Rede AErea Nua;WB0637;WB0637_MT;159;CORTE DE AREA ARBORIZADA EM LINHA DE MEIA TENSAO;m2
3000020379;Corte de área arborizada em linha de média tensão (Vegetação);THO104;MT;Linha MT;MT - LMT - Rede AErea Nua;WB0637;WB0637_MT;159;CORTE DE AREA ARBORIZADA EM LINHA DE MEIA TENSAO;m2
3000019853;Corte de árvore isolada em linha de baixa tensão (Vegetação);THO113;BT;Rede BT;BT - LBT - Rede AErea Nua;WB0645;WB0645_BT;160;CORTE DE ARVORE ISOLADA EM LINHA DE BAIXA TENSAO;UN
3000020387;Corte de árvore isolada em linha de baixa tensão (Vegetação);THO113;BT;Rede BT;BT - LBT - Rede AErea Nua;WB0645;WB0645_BT;160;CORTE DE ARVORE ISOLADA EM LINHA DE BAIXA TENSAO;UN
3000019854;Corte de árvore isolada em linha de média tensão (Vegetação);THO105;MT;Linha MT;MT - LMT - Rede AErea Nua;WB0638;WB0638_MT;161;CORTE DE ARVORE ISOLADA EM LINHA DE MEDIA TENSAO;UN
3000020388;Corte de árvore isolada em linha de média tensão (Vegetação);THO105;MT;Linha MT;MT - LMT - Rede AErea Nua;WB0638;WB0638_MT;161;CORTE DE ARVORE ISOLADA EM LINHA DE MEDIA TENSAO;UN
3000019855;Corte de bambu – com retirada de resíduos (Vegetação);TBR117;BT;Rede BT;BT - LBT - Rede AErea Nua;WB0612;WB0612_BT;162;CORTE DE BAMBU - COM RETIRADA DE RESIDUOS;UN
5000003129;Desconexão de pontes bypass de média tensão com linha viva em substituição (Rede elétrica MT);ABR514;MT;Linha MT;MT - LMT - Rede AErea Nua;WB0700;WB0700_MT;165;DESCONEXAO DE PONTES (BYPASS) DE MEDIA TENSAO COM LINHA VIVA  EM SUBSTITUICAO;CJT
5000002775;Desconexão de pontes bypass de média tensão com linha viva (Rede elétrica MT);ABR512;MT;Linha MT;MT - LMT - Rede AErea Nua;WB0696;WB0696_MT;164;DESCONEXAO DE PONTES (BYPASS) DE MEDIA TENSAO COM LINHA VIVA;CJT
5000003285;Desconexão de pontes bypass de média tensão com linha viva (Rede elétrica MT);ABR512;MT;Linha MT;MT - LMT - Rede AErea Nua;WB0696;WB0696_MT;164;DESCONEXAO DE PONTES (BYPASS) DE MEDIA TENSAO COM LINHA VIVA;CJT
3000021627;Destrancar e separar redes MT e BT (Rede elétrica);ABR232;BT;Rede BT;BT - LBT - Rede AErea Nua;WB0043;WB0043_BT;166;DESTRANCAR E SEPARAR REDES MT E BT;UN
3000019524;Diagnóstico do centro de transformação MT-BT (Inspeção);FHO120;BT;Rede BT;BT - LBT - Rede AErea Nua;WB0327;WB0327_BT;167;DIAGNOSTICO DO CENTRO DE TRANSFORMACAO MT BT;UN
3000022249;Reapertos e ajustes em estrutura, UC, equipamento de MT e BT (Manutenção elétrica);ABR238;BT;Rede BT;BT - LBT - Rede AErea Nua;WB0049;WB0049_BT;252;REAPERTOS E APARUSACOES EM ESTRUTURA, UC, EQUIPAMENTO DE MT E BT;UN
5000003281;Reapertos e ajustes em estrutura, UC, equipamento de MT e BT (Manutenção elétrica);ABR238;BT;Rede BT;BT - LBT - Rede AErea Nua;WB0049;WB0049_BT;252;REAPERTOS E APARUSACOES EM ESTRUTURA, UC, EQUIPAMENTO DE MT E BT;UN
3000019846;Estrada de acesso ou abertura/limpeza de faixa de servidão para terreno sem aclive e/ou sem pedras (Infraestrutura);TBR122;AT;Linha AT;AT - LDAT - Rede aErea nua;WB0615;WB0615_AT;169;ESTRADA DE ACESSO OU ABERTURA/LIMPEZA DE FAIXA DE SERVIDAO PARA TERRENO SEM ACLIVE E/OU SEM PEDRAS;m2
5000000494;Estrada de acesso ou abertura/limpeza de faixa de servidão para terreno sem aclive e/ou sem pedras (Infraestrutura);TBR122;AT;Linha AT;AT - LDAT - Rede aErea nua;WB0615;WB0615_AT;169;ESTRADA DE ACESSO OU ABERTURA/LIMPEZA DE FAIXA DE SERVIDAO PARA TERRENO SEM ACLIVE E/OU SEM PEDRAS;m2
5000000510;Estrada de acesso ou abertura/limpeza de faixa de servidão para terreno sem aclive e/ou sem pedras (Infraestrutura);TBR122;AT;Linha AT;AT - LDAT - Rede aErea nua;WB0615;WB0615_AT;169;ESTRADA DE ACESSO OU ABERTURA/LIMPEZA DE FAIXA DE SERVIDAO PARA TERRENO SEM ACLIVE E/OU SEM PEDRAS;m2
3000019825;Pequenas execuções em elementos de proteção OPEX (Proteção elétrica);AHO242;BT;Rede BT;BT - LBT - Rede AErea Nua;WB0172;WB0172_BT;235;PEQUENAS EXECUCÔES EM ELEMENTOS DE PROTECAO OPEX;UN
5000001212;Pequenas execuções em elementos de proteção OPEX (Proteção elétrica);AHO242;BT;Rede BT;BT - LBT - Rede AErea Nua;WB0172;WB0172_BT;235;PEQUENAS EXECUCÔES EM ELEMENTOS DE PROTECAO OPEX;UN
5000001225;Pequenas execuções em elementos de proteção OPEX (Proteção elétrica);AHO242;BT;Rede BT;BT - LBT - Rede AErea Nua;WB0172;WB0172_BT;235;PEQUENAS EXECUCÔES EM ELEMENTOS DE PROTECAO OPEX;UN
3000008507;Instalação de defensas em postes de distribuição ou transmissão (Infraestrutura / Segurança);ABR102;BT;Rede BT;BT - LBT - Rede AErea Nua;WB0002;WB0002_BT;185;Instalacao de Defensas em postes de distribuicao ou transmissao;UN
5000002908;Instalação de disjuntor termomagnético trifásico de 50A até 100A em serviço de substituição (Proteção elétrica);FBR116;BT;Ramal BT;BT - Ramal Simples;WB0255;WB0255_BT;186;INSTALACAO DE DISJUNTOR TERMOMAGNETICO TRIFASICO DE 50A ATE 100A EM SERVICO DE SUBSTITUICAO;UN
5000003379;Instalação de um isolador de pino ou cadeia com linha viva em serviço de substituição (Rede elétrica MT);ABR509;MT;Linha MT;MT - LMT - Rede AErea Nua;WB0690;WB0690_MT;201;INSTALACAO DE UM ISOLADOR DE PINO OU CADEIA COM LINHA VIVA EM SERVICO DE SUBSTITUICAO;CJT
5000003383;Instalação em substituição de um conjunto de fusíveis BT (Proteção elétrica);CBR210;BT;Rede BT;BT - LBT - Rede AErea Nua;WB1097;WB1097_BT;214;INSTALACAO EM SUBSTITUICAO DE UM CONJUNTO DE FUSIVEIS BT;CJT
3000021562;Instalação em substituição de estribos e/ou reajuste de conexões com linha viva (Rede elétrica MT);ABR117;MT;Linha MT;MT - LMT - Rede AErea Nua;WB0662;WB0662_MT;213;INSTALACAO EM SUBSTITUICAO DE ESTRIBOS E/OU REAJUSTE DE CONEXOES C/ LINHA VIVA;CJT
5000002762;Instalação em substituição de estribos e/ou reajuste de conexões com linha viva (Rede elétrica MT);ABR117;MT;Linha MT;MT - LMT - Rede AErea Nua;WB0662;WB0662_MT;213;INSTALACAO EM SUBSTITUICAO DE ESTRIBOS E/OU REAJUSTE DE CONEXOES C/ LINHA VIVA;CJT
3000019552;Instalação da estrutura e aparelhagem para um transformador em um poste (Rede elétrica MT/BT);FHO107;MT;TransformaCAo - MT;MT - Transformadores;WB0314;WB0314_MT;200;INSTALACAO DA ESTRUTURA E APARELHAGEM PARA UM TRANSFORMADOR EM UM POSTE;UN
3000020049;Instalação da estrutura e aparelhagem para um transformador em um poste (Rede elétrica MT/BT);FHO107;MT;TransformaCAo - MT;MT - Transformadores;WB0314;WB0314_MT;200;INSTALACAO DA ESTRUTURA E APARELHAGEM PARA UM TRANSFORMADOR EM UM POSTE;UN
5000003352;Instalação da estrutura e aparelhagem para um transformador em um poste (Rede elétrica MT/BT);FHO107;MT;TransformaCAo - MT;MT - Transformadores;WB0314;WB0314_MT;200;INSTALACAO DA ESTRUTURA E APARELHAGEM PARA UM TRANSFORMADOR EM UM POSTE;UN
5000003367;Instalação de transformador subterrâneo ou em superfície (Rede elétrica / Transformadores);FBR201;MT;TransformaCAo - MT;MT - Transformadores;WB0269;WB0269_MT;199;INSTALACAO DE TRANSFORMADOR SUBTERRANEO OU EM SUPERFICIE;UN
3000019351;Inspeção termográfica em linhas de média e baixa tensão com aporte de equipamento (Inspeção);AHO229;BT;Rede BT;BT - LBT - Rede AErea Nua;WB0161;WB0161_BT;172;INSPECAO TERMOGRAFICA EM LINHAS DE MEDIA E BAIXA TENSAO COM APORTE DE EQUIPAMENTO;PEC
3000008445;Inspeção visual em estrutura de MT/BT (Inspeção);AHO255;BT;Rede BT;BT - LBT - Rede AErea Nua;WB0176;WB0176_BT;176;INSPECAO VISUAL EM ESTRUTURA DE MT/BT;UN
3000019538;Inspeção de equipamentos aéreos (Inspeção);AHO233;MT;Linha MT;MT - LMT - Rede AErea Nua;WB0165;WB0165_MT;171;INSPECAO DE EQUIPAMENTOS AEREOS;UN
3000019352;Inspeção termográfica em linhas de média e baixa tensão sem aporte de equipamento (Inspeção);AHO228;BT;Rede BT;BT - LBT - Rede AErea Nua;WB0160;WB0160_BT;173;INSPECAO TERMOGRAFICA EM LINHAS DE MEDIA E BAIXA TENSAO SEM APORTE DE EQUIPAMENTO;PEC
3000019361;Inspeção visual de rede BT (Inspeção);AHO231;BT;Rede BT;BT - LBT - Rede AErea Nua;WB0163;WB0163_BT;174;INSPECAO VISUAL DE REDE  BT;km
3000019362;Inspeção visual de rede MT (Inspeção);AHO232;MT;Linha MT;MT - LMT - Rede AErea Nua;WB0164;WB0164_MT;175;INSPECAO VISUAL DE REDE MT;km
3000019458;Instalação de um seccionador aéreo unipolar lâminas, fusíveis, chave seccionadora(Proteção elétrica);AHO218;MT;Linha MT;MT - LMT - Rede AErea Nua;WB0150;WB0150_MT;205;INSTALACAO DE UM SECIONADOR AEREO UNIPOLAR (LAMINAS, FUSIVEIS, CHAVE SECCIONADORA);UN
3000020127;Instalação de um seccionador aéreo unipolar lâminas, fusíveis, chave seccionadora(Proteção elétrica);AHO218;MT;Linha MT;MT - LMT - Rede AErea Nua;WB0150;WB0150_MT;205;INSTALACAO DE UM SECIONADOR AEREO UNIPOLAR (LAMINAS, FUSIVEIS, CHAVE SECCIONADORA);UN
5000002777;Instalar alças ou fixação de encabeçamento em MT e BT com linha viva (Rede elétrica MT/BT);ABR810;MT;Linha MT;MT - LMT - Rede AErea Nua;WB0750;WB0750_MT;218;INSTALAR ALCAS OU FIXACAO DE ENCABECAMENTO EM MT E BT C/ LINHA VIVA;CJT
5000003381;Instalar alças ou fixação de encabeçamento em MT e BT com linha viva (Rede elétrica MT/BT);ABR810;MT;Linha MT;MT - LMT - Rede AErea Nua;WB0750;WB0750_MT;218;INSTALAR ALCAS OU FIXACAO DE ENCABECAMENTO EM MT E BT C/ LINHA VIVA;CJT
3000019453;Instalar condutores de 10 mm² a 50 mm² cobre ou seu equivalente em alumínio (Rede elétrica BT);AHO201;BT;Rede BT;BT - LBT - Cabo aEreo;WB0135;WB0135_BT;220;INSTALAR CONDUTORES DE 10 MM2 A 50 MM2 COBRE OU SEU EQUIVALENTE EM ALUMINIO.;m
5000000369;Instalar condutores de 10 mm² a 50 mm² cobre ou seu equivalente em alumínio (Rede elétrica BT);AHO201;BT;Rede BT;BT - LBT - Cabo aEreo;WB0135;WB0135_BT;220;INSTALAR CONDUTORES DE 10 MM2 A 50 MM2 COBRE OU SEU EQUIVALENTE EM ALUMINIO.;m
3000019441;Instalação de condutor pré-reunido de baixa tensão (PR BT) (Rede elétrica BT);AHO243;BT;Rede BT;BT - LBT - Cabo aEreo;WB0173;WB0173_BT;182;INSTALACAO DE CONDUTOR PRE REUNIDO DE BAIXA TENSAO (PR BT);m
5000000383;Instalação de condutor pré-reunido de baixa tensão (PR BT) (Rede elétrica BT);AHO243;BT;Rede BT;BT - LBT - Cabo aEreo;WB0173;WB0173_BT;182;INSTALACAO DE CONDUTOR PRE REUNIDO DE BAIXA TENSAO (PR BT);m
595178;Instalação de cruzeta simples ou dupla com encabeçamento com linha viva (Rede elétrica MT);AHO814;MT;Linha MT;MT - LMT - Rede AErea Nua;WB0782;WB0782_MT;180;INSTALACAO DE  CRUZETA SIMPLES  OU DUPLA COM ENCABECAMENTO C/ LINHA VIVA;UN
3000019564;Instalação de cruzeta simples ou dupla com encabeçamento com linha viva (Rede elétrica MT);AHO814;MT;Linha MT;MT - LMT - Rede AErea Nua;WB0782;WB0782_MT;180;INSTALACAO DE  CRUZETA SIMPLES  OU DUPLA COM ENCABECAMENTO C/ LINHA VIVA;UN
3000021555;Instalação de uma emenda em BT cabos (Rede elétrica BT);ABR220;BT;Rede BT;BT - LBT - Cabo aEreo;WB0031;WB0031_BT;208;INSTALACAO DE UMA EMENDA EM BT (CABOS);UN
3000021598;Instalação de uma emenda em MT cabos (Rede elétrica MT);ABR217;MT;Linha MT;MT - LMT - Rede AErea Nua;WB0028;WB0028_MT;210;INSTALACAO DE UMA EMENDA EM MT (CABOS);UN
5000003103;Instalação de uma emenda em MT cabos (Rede elétrica MT);ABR217;MT;Linha MT;MT - LMT - Rede AErea Nua;WB0028;WB0028_MT;210;INSTALACAO DE UMA EMENDA EM MT (CABOS);UN
3000008027;Instalação de cobertas de proteção em vãos de rede (Segurança);ABR119;MT;Linha MT;MT - LMT - Rede AErea Nua;WB0666;WB0666_MT;181;INSTALACAO DE COBERTAS DE PROTECAO EM VAOS DE REDE;UN
594690;Instalação de conector AL/CU/AL-AL todas as seções com linha viva (Rede elétrica MT);AHO821;MT;Linha MT;MT - LMT - Rede AErea Nua;WB0797;WB0797_MT;183;INSTALACAO DE CONECTOR AL/CU/AL-AL (TODAS AS SECOES) COM LINHA VIVA;UN
3000020071;Instalação de conector AL/CU/AL-AL todas as seções com linha viva (Rede elétrica MT);AHO821;MT;Linha MT;MT - LMT - Rede AErea Nua;WB0797;WB0797_MT;183;INSTALACAO DE CONECTOR AL/CU/AL-AL (TODAS AS SECOES) COM LINHA VIVA;UN
3000019550;Instalação de poste de BT e estrutura (Infraestrutura);AHO111;BT;Rede BT;BT - LBT - Cabo aEreo;WB0105;WB0105_BT;193;INSTALACAO DE POSTE  DE BT E ESTRUTURA;UN
3000021556;Instalação de uma emenda em BT cabos em serviço de substituição (Rede elétrica BT);ABR221;BT;Rede BT;BT - LBT - Cabo aEreo;WB0032;WB0032_BT;209;INSTALACAO DE UMA EMENDA EM BT (CABOS) EM SERVICO DE SUBSTITUICAO;CJT
5000003096;Instalação de uma emenda em BT cabos em serviço de substituição (Rede elétrica BT);ABR221;BT;Rede BT;BT - LBT - Cabo aEreo;WB0032;WB0032_BT;209;INSTALACAO DE UMA EMENDA EM BT (CABOS) EM SERVICO DE SUBSTITUICAO;CJT
5000002814;Instalação de um terminal bimetálico BT em serviço de substituição (Rede elétrica BT);ABR229;BT;Rede BT;BT - LBT - Cabo aEreo;WB0040;WB0040_BT;206;INSTALACAO DE UM TERMINAL BIMETALICO BT EM SERVICO DE SUBSTITUICAO;UN
3000021619;Instalação de uma emenda em MT cabos em serviço de substituição (Rede elétrica MT);ABR218;MT;Linha MT;MT - LMT - Rede AErea Nua;WB0029;WB0029_MT;211;INSTALACAO DE UMA EMENDA EM MT (CABOS) EM SERVICO DE SUBSTITUICAO;UN
5000003235;Instalação de isoladores de qualquer tipo em linha aérea ou em subestação em serviço de substituição (Rede elétrica MT/BT);ABR241;MT;Linha MT;MT - LMT - Cabo aEreo;WB0052;WB0052_MT;189;INSTALACAO DE ISOLADORES DE QUALQUER TIPO EM LINHA AEREA OU EM SUBESTACAO EM SERVICO DE SUBSTITUICAO ;CJT
3000008338;Instalação de uma emenda automática em MT cabos (Rede elétrica MT);ABR208;MT;Linha MT;MT - LMT - Rede AErea Nua;WB0019;WB0019_MT;207;Instalacao de uma emenda automatica em MT (Cabos);UN
3000008339;Instalação de uma emenda automática em MT cabos (Rede elétrica MT);ABR208;MT;Linha MT;MT - LMT - Rede AErea Nua;WB0019;WB0019_MT;207;Instalacao de uma emenda automatica em MT (Cabos);UN
594747;Instalação do equipamento de proteção monofásica e pára-raio MT/BT com linha viva (Proteção elétrica);AHO823;MT;SubestaCAo MT;MT - SubestaCoes MV/LV - peCa eletromecAnica;WB0800;WB0800_MT;212;INSTALACAO DO EQUIPAMENTO DE  PROTECAO MONOFASICA E PARARRAIO  MT/BT C/ LINHA VIVA;UN
595247;Instalação do equipamento de proteção monofásica e pára-raio MT/BT com linha viva (Proteção elétrica);AHO823;MT;SubestaCAo MT;MT - SubestaCoes MV/LV - peCa eletromecAnica;WB0800;WB0800_MT;212;INSTALACAO DO EQUIPAMENTO DE  PROTECAO MONOFASICA E PARARRAIO  MT/BT C/ LINHA VIVA;UN
3000008029;Instalação de estribos com linha viva (Rede elétrica MT);ABR115;MT;Linha MT;MT - LMT - Rede AErea Nua;WB0658;WB0658_MT;187;INSTALACAO DE ESTRIBOS C/ LINHA VIVA;CJT
5000002761;Instalação de estribos com linha viva (Rede elétrica MT);ABR115;MT;Linha MT;MT - LMT - Rede AErea Nua;WB0658;WB0658_MT;187;INSTALACAO DE ESTRIBOS C/ LINHA VIVA;CJT
3000019548;Instalação de cruzeta simples ou dupla para condutor nu em poste existente (Rede elétrica MT);AHO121;MT;Linha MT;MT - LMT - Cabo aEreo;WB0114;WB0114_MT;184;INSTALACAO DE CRUZETA SIMPLES OU DUPLA PARA CONDUTOR DESNUDO EM POSTE EXISTENTE;UN
3000020045;Instalação de cruzeta simples ou dupla para condutor nu em poste existente (Rede elétrica MT);AHO121;MT;Linha MT;MT - LMT - Cabo aEreo;WB0114;WB0114_MT;184;INSTALACAO DE CRUZETA SIMPLES OU DUPLA PARA CONDUTOR DESNUDO EM POSTE EXISTENTE;UN
3000008385;Instalação do medidor para balanço em cargas (Medição);ABR403;BT;Grupo de Medida - BT;BT - Medidor BalanCo EnergEtico;WB0080;WB0080_BT;177;INSTALACAO  DO MEDIDOR PARA BALANCO EM CARGAS;UN
3000008386;Instalação do medidor para balanço em cargas (Medição);ABR403;BT;Grupo de Medida - BT;BT - Medidor BalanCo EnergEtico;WB0080;WB0080_BT;177;INSTALACAO  DO MEDIDOR PARA BALANCO EM CARGAS;UN
5000000738;Instalação de painel/caixa de controle montada em poste (Infraestrutura);AHO219;MT;SubestaCAo MT;MT - SubestaCoes MV/LV - peCa eletromecAnica;WB0151;WB0151_MT;190;INSTALACAO DE PAINEL/CAIXA DE CONTROLE MONTADA EM POSTE;UN
5000000740;Instalação de painel/caixa de controle montada em poste (Infraestrutura);AHO219;MT;SubestaCAo MT;MT - SubestaCoes MV/LV - peCa eletromecAnica;WB0151;WB0151_MT;190;INSTALACAO DE PAINEL/CAIXA DE CONTROLE MONTADA EM POSTE;UN
3000020090;Instalação de poste de MT de 10 a 15 metros ou estrutura de encabeçamento com linha viva (Infraestrutura MT);AHO806;MT;Linha MT;MT - LMT - Rede AErea Nua;WB0767;WB0767_MT;195;INSTALACAO DE POSTE  DE MT DE 10 A 15 METROS OU ESTRUTURA DE ENCABECAMENTO C/ LINHA VIVA;UN
3000019596;Instalação de poste (disposição passante) MT de 10 a 15 metros com linha viva (Infraestrutura MT);AHO804;MT;Linha MT;MT - LMT - Rede AErea Nua;WB0762;WB0762_MT;196;INSTALACAO DE POSTE (DISPOSICAO PASSANTE) MT DE 10 A 15 METROS COM LINHA VIVA;UN
3000020093;Instalação de poste (disposição passante) MT de 10 a 15 metros com linha viva (Infraestrutura MT);AHO804;MT;Linha MT;MT - LMT - Rede AErea Nua;WB0762;WB0762_MT;196;INSTALACAO DE POSTE (DISPOSICAO PASSANTE) MT DE 10 A 15 METROS COM LINHA VIVA;UN
3000019591;Instalação de poste de BT com concreto (Infraestrutura BT);AHO113;BT;Rede BT;BT - LBT - Cabo aEreo;WB0107;WB0107_BT;192;INSTALACAO DE POSTE  DE BT COM CONCRETO;UN
3000019592;Instalação de poste de MT com concreto (Infraestrutura MT);AHO112;MT;Linha MT;MT - LMT - Cabo aEreo;WB0106;WB0106_MT;194;INSTALACAO DE POSTE  DE MT COM CONCRETO;UN
3000019606;Instalação de ramal aéreo BT trifásico de seção entre 36 mm² e 120 mm² (Rede elétrica BT);CHO505;BT;Ramal BT;BT - Ramal Simples;WB1251;WB1251_BT;197;INSTALACAO DE RAMAL AEREO BT TRIFASICO DE SECAO ENTRE 36 MM2 E 120 MM2;UN
5000000371;Instalar rede com condutores acima de 120 mm² cobre ou equivalente em alumínio (Rede elétrica BT);AHO203;MT;Linha MT;MT - LMT - Cabo aEreo;WB0137;WB0137_MT;221;INSTALAR REDE COM CONDUTORES ACIMA DE 120 MM2 COBRE OU SEU EQUIVALENTE EM ALUMINIO.;m
3000019456;Instalação de um seccionador ou religador (SF6, óleo, vácuo) sem caixa de controle (Proteção elétrica);AHO217;MT;SubestaCAo MT;MT - SubestaCoes MV/LV - peCa eletromecAnica;WB0149;WB0149_MT;203;INSTALACAO DE UM SECCIONADOR OU RELIGADOR (SF6, OLEO, VAZIO) SEM CAIXA DE CONTROLE;UN
3000020125;Instalação de um seccionador ou religador (SF6, óleo, vácuo) sem caixa de controle (Proteção elétrica);AHO217;MT;SubestaCAo MT;MT - SubestaCoes MV/LV - peCa eletromecAnica;WB0149;WB0149_MT;203;INSTALACAO DE UM SECCIONADOR OU RELIGADOR (SF6, OLEO, VAZIO) SEM CAIXA DE CONTROLE;UN
3000019336;Instalação ou substituição de isoladores de qualquer tipo em linha aérea ou em subestação (Rede elétrica MT/BT);AHO239;MT;Linha MT;MT - LMT - Rede AErea Nua;WB0169;WB0169_MT;188;INSTALACAO OU SUBSTITUICAO DE ISOLADORES DE QUALQUER TIPO EM LINHA AEREA OU EM SUBESTACAO ;UN
3000019329;Instalação, substituição ou retirada de uma emenda em BT cabos (Rede elétrica BT);AHO215;BT;Rede BT;BT - LBT - Cabo aEreo;WB0147;WB0147_BT;217;INSTALACAO  SUSTITUICAO OU RETIRADA  DE UMA EMENDA EM BT (CABOS);UN
3000019870;Instalação, substituição ou retirada de uma emenda em BT cabos (Rede elétrica BT);AHO215;BT;Rede BT;BT - LBT - Cabo aEreo;WB0147;WB0147_BT;217;INSTALACAO  SUSTITUICAO OU RETIRADA  DE UMA EMENDA EM BT (CABOS);UN
3000019638;Instalação ou retirada de cobertas de proteção em vãos de rede (Segurança);AHO822;MT;Linha MT;MT - LMT - Rede AErea Nua;WB0799;WB0799_MT;216;INSTALACAO OU RETIRADA DE COBERTAS DE PROTECAO EM VAOS DE REDE.;UN
3000020144;Instalação ou retirada do medidor para balanço em cargas (Medição);AHO620;BT;Grupo de Medida - BT;BT - Medidor BalanCo EnergEtico;WB0195;WB0195_BT;215;INSTALACAO OU RETIRADA DO MEDIDOR PARA BALANCO EM CARGAS;UN
3000019457;Instalação de um seccionador ou religador (SF6, óleo, vácuo) sem caixa de controle com linha viva (Proteção elétrica);AHO828;MT;Linha MT;MT - LMT - Rede AErea Nua;WB0810;WB0810_MT;204;INSTALACAO DE UM SECCIONADOR OU RELIGADOR (SF6, OLEO, VAZIO) SEM CAIXA DE CONTROLE COM LINHA VIVA;UN
3000020126;Instalação de um seccionador ou religador (SF6, óleo, vácuo) sem caixa de controle com linha viva (Proteção elétrica);AHO828;MT;Linha MT;MT - LMT - Rede AErea Nua;WB0810;WB0810_MT;204;INSTALACAO DE UM SECCIONADOR OU RELIGADOR (SF6, OLEO, VAZIO) SEM CAIXA DE CONTROLE COM LINHA VIVA;UN
3000019331;Instalação de armação secundária (simples ou dupla) (Infraestrutura);AHO123;BT;Rede BT;BT - LBT - Cabo aEreo;WB0116;WB0116_BT;178;INSTALACAO ARMACAO SECUNDARIA (SIMPLES OU DUPLA);UN
3000019873;Instalação de pára-raios (Proteção elétrica);AHO222;MT;Linha AT;AT - LDAT - Armamento;WB0154;WB0154_MT;191;INSTALACAO DE PARA-RAIOS;UN
5000002816;Instalar bypass em caixa de derivação (Rede elétrica BT);ABR231;BT;Rede BT;BT - LBT - Rede AErea Nua;WB0042;WB0042_BT;219;INSTALAR BY-PASS EM CAIXA DE DERIVACAO;UN
5000003366;Lavagem de rede aérea com equipamentos (transformadores, reguladores e religadores) (Manutenção elétrica);FHO138;BT;Rede BT;BT - LBT - Rede AErea Nua;WB0343;WB0343_BT;222;LAVAGEM DE REDE AEREA COM EQUIPAMENTOS (TRANSFORMADORES, REGULADORES E RELIGADORES);UN
594482;Levantamento cartográfico/planimetria da rede (Topografia);ABR728;BT;Rede BT;BT - LBT - Rede AErea Nua;WB0096;WB0096_BT;223;LEVANTAMIENTO DE CARTOGRAFICA / PLANIMETRIA DA REDE;km
3000019906;Levantamento cartográfico/planimetria da rede (Topografia);ABR728;BT;Rede BT;BT - LBT - Rede AErea Nua;WB0096;WB0096_BT;223;LEVANTAMIENTO DE CARTOGRAFICA / PLANIMETRIA DA REDE;km
3000019320;Levantar ou abaixar redes MT com linha viva (Rede elétrica MT);AHO818;MT;Linha MT;MT - LMT - Rede AErea Nua;WB0791;WB0791_MT;224;LEVANTAR OU ABAIXAR REDES MT COM LINHA VIVA;UN
3000020358;Levantar ou abaixar redes MT com linha viva (Rede elétrica MT);AHO818;MT;Linha MT;MT - LMT - Rede AErea Nua;WB0791;WB0791_MT;224;LEVANTAR OU ABAIXAR REDES MT COM LINHA VIVA;UN
3000008259;Limpeza de faixa de servidão em terreno (Infraestrutura);TBR129;MT;Linha MT;MT - LMT - Rede AErea Nua;WB0622;WB0622_MT;226;LIMPEZA DE FAIXA DE SERVIDAO EM TERRENO ;m2
5000003298;Manutenção integral de subestações aéreas (em dois postes ou reguladores de tensão) (Subestações);FHO130;MT;SubestaCAo MT;MT - SubestaCoes MV/LV - peCa eletromecAnica;WB0336;WB0336_MT;230;MANUTENCAO INTEGRAL DE SUBESTACOES  AEREAS (SUBESTACOES AEREAS EM DOIS POSTES OU REGULADORES DE TENSAO) ;UN
3000019704;Manutenção menor em rede aérea BT (Manutenção elétrica);AHO234;BT;Rede BT;BT - LBT - Cabo aEreo;WB0166;WB0166_BT;228;MANUTENCAO MENOR EM REDE AEREA BT ;UN
3000019705;Manutenção em rede aérea MT (Manutenção elétrica);AHO235;MT;SubestaCAo MT;MT - SubestaCoes MV/LV - peCa eletromecAnica;WB0167;WB0167_MT;229;MANUTENCAO EM REDE AEREA MT;UN
3000019338;Manutenção ou retirada de tirante (Infraestrutura);AHO128;MT;Linha MT;MT - LMT - Rede AErea Nua;WB0121;WB0121_MT;231;MANUTENCAO OU RETIRADA DE TIRANTE;UN
3000019879;Manutenção ou retirada de tirante (Infraestrutura);AHO128;MT;Linha MT;MT - LMT - Rede AErea Nua;WB0121;WB0121_MT;231;MANUTENCAO OU RETIRADA DE TIRANTE;UN
3000020224;Nivelamento e sustentação do poste MT com linha viva (Infraestrutura MT);AHO811;MT;Linha MT;MT - LMT - Rede AErea Nua;WB0777;WB0777_MT;233;NIVELAMENTO E SUSTENTACAO DO POSTE MT COM LINHA VIVA;UN
5000000025;Operação em equipamentos de distribuição aérea MT (Rede elétrica MT);AHO730;MT;Linha MT;MT - LMT - Cabo aEreo;WB0201;WB0201_MT;234;OPERACAO EM EQUIPAMENTOS DE DISTRIBUICAO AEREA MT;CJT
